{
  "$schema": "./schema/poa-beta-content-pack.schema.json",
  "schemaVersion": 1,
  "packId": "afterwatch-night-watch-beta-one",
  "status": {
    "tier": "beta-draft",
    "spoilers": true,
    "authoritative": false,
    "storyAuthority": "Sentyr (@alteron808)",
    "activationState": "not-activated"
  },
  "designSources": [
    {
      "source": "Neocadia recurring-place and daily-system specifications",
      "borrowedShape": "A familiar room, several tiny return verbs, deterministic daily rotation, and alternatives that do not punish late visitors.",
      "excludedMaterial": "All setting, characters, prose, currencies, streaks, reward arithmetic, and generated lore."
    },
    {
      "source": "Dregg authored-dungeon and Descent systems",
      "borrowedShape": "Small directed topology, explicit gates, finite resources, exact extraction, alternate routes, and replayable consequences.",
      "excludedMaterial": "Existing dungeon names, rooms, NPCs, objects, narration, and fantasy skin."
    },
    {
      "source": "Path of Angels Galley Commons and Maintenance Daily semantics",
      "borrowedShape": "At least three bounded choices with neighborly alternatives, one visit per finalized day, and an ordered procedure of at most eight steps.",
      "excludedMaterial": "No browser clock, streak, free asset mint, automatic canon, or holder advantage."
    },
    {
      "source": "Path of Angels Crew Field Mission and deck graph semantics",
      "borrowedShape": "Four exact roles, private observations disclosed by signed handoff, three routes, supported safe return, unanimous deep recovery, and extraction-reachable phase-aware topology.",
      "excludedMaterial": "No claim of deployed briefing privacy, runtime settlement, or activated expedition content."
    }
  ],
  "canonBoundary": {
    "gameplayTier": "beta",
    "alphaAuthority": "sentyr-explicit-curator-action",
    "automaticPromotion": false,
    "interpretationRule": "The pack may assert finite game behavior and what instruments record. It may not decide why Artificer machinery behaves that way, what an object ultimately is, or whether any observation is true in the show."
  },
  "recurringPlace": {
    "id": "afterwatch-galley",
    "workingName": "The Afterwatch Galley",
    "pitch": "A human-scale island built inside a room that was never designed as a galley: warm, overworked, patched in six incompatible eras, and close enough to the expedition lifts that returning crews arrive before their explanations do.",
    "playerVerbs": [
      "take-serving",
      "work-maintenance",
      "read-scar-table",
      "provision-expedition",
      "leave-field-note"
    ],
    "stations": [
      {
        "id": "reconstitution-rail",
        "workingName": "Reconstitution Rail",
        "function": "Presents the day's bounded commons choices and always offers a neighborly alternative after a featured serving is gone.",
        "changesWhen": "A finalized-day rotation changes, a serving reaches capacity, or a maintenance result is durably recorded."
      },
      {
        "id": "scar-table",
        "workingName": "Scar Table",
        "function": "A table whose repairs, burns, route scratches, and crew annotations become a local history rather than disposable flavor text.",
        "changesWhen": "A crew returns, a beta field record is pinned, or Sentyr chooses a trace to preserve in a later content epoch."
      },
      {
        "id": "return-lock-window",
        "workingName": "Return-lock Window",
        "function": "Faces the service lift and makes extraction arrivals, quarantine delays, and missing equipment visible to the room.",
        "changesWhen": "An expedition closes with a recovery consequence; presentation reflects only a settled result."
      },
      {
        "id": "vat-service-trench",
        "workingName": "Vat Service Trench",
        "function": "Hosts the bounded daily maintenance procedure and exposes enough sound, pressure, and flow state to make the work legible.",
        "changesWhen": "The procedure advances in exact order or the next activated maintenance task supersedes it."
      }
    ],
    "persistentTraces": [
      "A returned crew may leave one provenance-linked field note on the Scar Table; free prose remains commentary, not canon.",
      "A settled maintenance result may change one visible instrument state for the active content epoch.",
      "Recovery consequences can temporarily alter props at the Return-lock Window but cannot silently debit global world meters.",
      "A promoted hook may preserve one exact phrase, shape, or object reference; rejected drafts remain beta records."
    ],
    "sentyrQuestions": [
      "Would the crew themselves call this the Afterwatch Galley, or is that an outsider's tidy name for a messier place?",
      "Who actually keeps this place socially coherent when expedition officers and ordinary residents collide?",
      "Which visible part of the Galley would reveal too much about the Khovokhi this early and should therefore remain off-camera or sealed?"
    ]
  },
  "commonsRotations": [
    {
      "id": "rotation-pressure-weather",
      "sceneCopy": "The serving rail clicks with each distant pressure correction. Nobody looks up until the third one comes early.",
      "choices": [
        {
          "id": "steady-bowl",
          "workingLabel": "Steady Bowl",
          "capacity": 24,
          "localService": 8,
          "servedCopy": "The bowl is hot, plain, and correctly salted. Today that counts as engineering.",
          "alternativeCopy": "The hot batch is gone. The rail opens a shelf of sealed travel portions and somebody has already left spoons beside them.",
          "provisioningTag": "steady"
        },
        {
          "id": "watch-cup",
          "workingLabel": "Watch Cup",
          "capacity": 12,
          "localService": 5,
          "servedCopy": "A bitter cup that warms the tongue before the hands. The label recommends one. The handwriting below it recommends honesty.",
          "alternativeCopy": "The concentrate is spent, so the rail dilutes the last measure into a shared pot. It is weaker and there is enough for everyone.",
          "provisioningTag": "alert"
        },
        {
          "id": "soft-return",
          "workingLabel": "Soft Return",
          "capacity": 8,
          "localService": 12,
          "servedCopy": "The texture is deliberately unremarkable. A returning crew member closes both hands around it anyway.",
          "alternativeCopy": "The recovery tray is empty. The galley marks a fresh plate for the next batch and serves you from the ordinary pot with the same blue cup.",
          "provisioningTag": "recovery"
        },
        {
          "id": "lift-packet",
          "workingLabel": "Lift Packet",
          "capacity": 6,
          "localService": 3,
          "servedCopy": "A compact ration locks shut around a warming tab and a strip for writing the route home.",
          "alternativeCopy": "The expedition packets are assigned. The quartermaster's shelf offers the same food in an inelegant container and asks you to bring that one back.",
          "provisioningTag": "expedition"
        }
      ]
    },
    {
      "id": "rotation-quiet-shift",
      "sceneCopy": "The room is between watches. The rail keeps serving, the Scar Table keeps its own counsel, and the return lift has not moved for forty minutes.",
      "choices": [
        {
          "id": "quiet-broth",
          "workingLabel": "Quiet Broth",
          "capacity": 18,
          "localService": 7,
          "servedCopy": "Steam erases the reflection on the bowl before you can decide whose face it resembled.",
          "alternativeCopy": "The broth is finished. A covered tray holds baked ration squares and a note: QUIET IS NOT THE SAME AS EMPTY.",
          "provisioningTag": "steady"
        },
        {
          "id": "salt-fold",
          "workingLabel": "Salt Fold",
          "capacity": 10,
          "localService": 6,
          "servedCopy": "Thin layers crack apart around a sharp mineral filling. Someone has counted the layers in pencil: eleven, then thirteen, then eleven again.",
          "alternativeCopy": "Only crumbs remain. The rail gathers them into a warm cup with stock; the layer count is no longer anybody's problem.",
          "provisioningTag": "alert"
        },
        {
          "id": "shared-heel",
          "workingLabel": "Shared Heel",
          "capacity": 32,
          "localService": 4,
          "servedCopy": "A dense end-piece, cut thick enough to trade half without making a ceremony of it.",
          "alternativeCopy": "The basket is empty. A crew at the Scar Table silently moves their untouched plate to the rail and pretends not to notice who takes it.",
          "provisioningTag": "recovery"
        },
        {
          "id": "sealed-flask",
          "workingLabel": "Sealed Flask",
          "capacity": 5,
          "localService": 2,
          "servedCopy": "The seal shows yesterday's pressure, today's route mark, and a blank square for the person who carries it back.",
          "alternativeCopy": "No calibrated flasks remain. The rail offers an ordinary bottle and prints a tag that says NOT FOR FIELD METRICS in letters nobody can miss.",
          "provisioningTag": "expedition"
        }
      ]
    },
    {
      "id": "rotation-return-alarm",
      "sceneCopy": "The return-lock lamp goes amber halfway through service. The Galley lowers its voice without stopping work; a clean place is cleared at the Scar Table and four cups are set there before anyone knows how many will return.",
      "choices": [
        {
          "id": "amber-mash",
          "workingLabel": "Amber Mash",
          "capacity": 20,
          "localService": 9,
          "servedCopy": "The mash tastes faintly of toasted grain. Its bowl has a wide foot so a shaking hand cannot easily overturn it.",